[
  {
    "id": "q_spec_grammar_001_001",
    "knowledgePointId": "eng_grammar_place_in_inside_into_a2",
    "questionSpecId": "spec_grammar_001",
    "questionType": "MULTIPLE_CHOICE",
    "difficulty": "A2",
    "questionPurpose": "APPLICATION",
    "cognitiveLevel": "APPLY",
    "question": {
      "stem": "Every morning, Sara puts her lunch box ___ her backpack before school.",
      "context": "daily routines",
      "options": [
        { "id": "A", "text": "in" },
        { "id": "B", "text": "inside" },
        { "id": "C", "text": "into" },
        { "id": "D", "text": "on" }
      ]
    },
    "answer": {
      "value": "into",
      "correctOptionIds": ["C"],
      "acceptedAnswers": ["into"]
    },
    "explanation": "The action 'puts' shows movement from outside to inside, so 'into' is correct.",
    "testedAspects": [
      "into for movement from outside to inside",
      "simple present in daily routine",
      "third-person singular verb form"
    ],
    "distractors": [
      {
        "optionId": "A",
        "reason": "Learner confuses position ('in') with movement direction.",
        "errorType": "position_vs_movement"
      },
      {
        "optionId": "B",
        "reason": "Learner overuses 'inside' even when directional 'into' is required.",
        "errorType": "inside_overgeneralization"
      },
      {
        "optionId": "D",
        "reason": "Learner chooses an unrelated place preposition that does not express entering.",
        "errorType": "wrong_preposition"
      }
    ],
    "tags": [
      "grammar",
      "prepositions",
      "in_inside_into",
      "A2",
      "daily routines"
    ],
    "metadata": {
      "source": "eng_grammar_place_in_inside_into_a2",
      "generatedBy": "GPT-5.3-Codex",
      "generatedAt": "2026-08-11T00:00:00Z",
      "version": "1.0"
    }
  },
  {
    "id": "q_spec_grammar_001_002",
    "knowledgePointId": "eng_grammar_place_in_inside_into_a2",
    "questionSpecId": "spec_grammar_001",
    "questionType": "MULTIPLE_CHOICE",
    "difficulty": "A2",
    "questionPurpose": "APPLICATION",
    "cognitiveLevel": "APPLY",
    "question": {
      "stem": "Before class starts, his water bottle stays ___ his school bag.",
      "context": "daily routines",
      "options": [
        { "id": "A", "text": "in" },
        { "id": "B", "text": "into" },
        { "id": "C", "text": "on" },
        { "id": "D", "text": "at" }
      ]
    },
    "answer": {
      "value": "in",
      "correctOptionIds": ["A"],
      "acceptedAnswers": ["in"]
    },
    "explanation": "'Stays' describes position, not movement, so 'in' is the neutral and correct choice.",
    "testedAspects": [
      "in for position",
      "simple present in daily routine",
      "third-person singular verb form"
    ],
    "distractors": [
      {
        "optionId": "B",
        "reason": "Learner uses 'into' where no movement happens.",
        "errorType": "movement_without_motion"
      },
      {
        "optionId": "C",
        "reason": "Learner selects a surface-contact preposition instead of inside position.",
        "errorType": "wrong_relation"
      },
      {
        "optionId": "D",
        "reason": "Learner chooses a general location marker that does not mean inside a container.",
        "errorType": "wrong_relation"
      }
    ],
    "tags": [
      "grammar",
      "prepositions",
      "in_inside_into",
      "A2",
      "daily routines"
    ],
    "metadata": {
      "source": "eng_grammar_place_in_inside_into_a2",
      "generatedBy": "GPT-5.3-Codex",
      "generatedAt": "2026-08-11T00:00:00Z",
      "version": "1.0"
    }
  },
  {
    "id": "q_spec_grammar_001_003",
    "knowledgePointId": "eng_grammar_place_in_inside_into_a2",
    "questionSpecId": "spec_grammar_001",
    "questionType": "MULTIPLE_CHOICE",
    "difficulty": "A2",
    "questionPurpose": "APPLICATION",
    "cognitiveLevel": "APPLY",
    "question": {
      "stem": "When it gets cold, his mother says, \"Come ___ now.\"",
      "context": "daily routines",
      "options": [
        { "id": "A", "text": "in" },
        { "id": "B", "text": "inside" },
        { "id": "C", "text": "into" },
        { "id": "D", "text": "at" }
      ]
    },
    "answer": {
      "value": "inside",
      "correctOptionIds": ["B"],
      "acceptedAnswers": ["inside"]
    },
    "explanation": "After 'come', no noun follows, so 'inside' works as an adverb and is correct.",
    "testedAspects": [
      "inside as adverb without a following noun",
      "simple present in daily routine",
      "third-person singular verb form"
    ],
    "distractors": [
      {
        "optionId": "A",
        "reason": "Learner chooses a preposition but ignores that an adverb is needed here.",
        "errorType": "preposition_vs_adverb"
      },
      {
        "optionId": "C",
        "reason": "Learner uses directional 'into' without an object noun.",
        "errorType": "missing_object_after_into"
      },
      {
        "optionId": "D",
        "reason": "Learner uses an unrelated place preposition.",
        "errorType": "wrong_preposition"
      }
    ],
    "tags": [
      "grammar",
      "prepositions",
      "in_inside_into",
      "A2",
      "daily routines"
    ],
    "metadata": {
      "source": "eng_grammar_place_in_inside_into_a2",
      "generatedBy": "GPT-5.3-Codex",
      "generatedAt": "2026-08-11T00:00:00Z",
      "version": "1.0"
    }
  },
  {
    "id": "q_spec_grammar_001_004",
    "knowledgePointId": "eng_grammar_place_in_inside_into_a2",
    "questionSpecId": "spec_grammar_001",
    "questionType": "MULTIPLE_CHOICE",
    "difficulty": "A2",
    "questionPurpose": "APPLICATION",
    "cognitiveLevel": "APPLY",
    "question": {
      "stem": "After P.E., Ken runs ___ the gym to get his jacket.",
      "context": "daily routines",
      "options": [
        { "id": "A", "text": "inside" },
        { "id": "B", "text": "in" },
        { "id": "C", "text": "into" },
        { "id": "D", "text": "under" }
      ]
    },
    "answer": {
      "value": "into",
      "correctOptionIds": ["C"],
      "acceptedAnswers": ["into"]
    },
    "explanation": "The verb 'runs' shows movement toward the inside of the gym, so 'into' is correct.",
    "testedAspects": [
      "into for movement from outside to inside",
      "simple present in daily routine",
      "third-person singular verb form"
    ],
    "distractors": [
      {
        "optionId": "A",
        "reason": "Learner confuses adverb/adjective-like 'inside' with directional preposition.",
        "errorType": "word_class_confusion"
      },
      {
        "optionId": "B",
        "reason": "Learner selects static location instead of movement.",
        "errorType": "position_vs_movement"
      },
      {
        "optionId": "D",
        "reason": "Learner picks an unrelated spatial relation.",
        "errorType": "wrong_relation"
      }
    ],
    "tags": [
      "grammar",
      "prepositions",
      "in_inside_into",
      "A2",
      "daily routines"
    ],
    "metadata": {
      "source": "eng_grammar_place_in_inside_into_a2",
      "generatedBy": "GPT-5.3-Codex",
      "generatedAt": "2026-08-11T00:00:00Z",
      "version": "1.0"
    }
  },
  {
    "id": "q_spec_grammar_001_005",
    "knowledgePointId": "eng_grammar_place_in_inside_into_a2",
    "questionSpecId": "spec_grammar_001",
    "questionType": "MULTIPLE_CHOICE",
    "difficulty": "A2",
    "questionPurpose": "APPLICATION",
    "cognitiveLevel": "APPLY",
    "question": {
      "stem": "Each night, Lily keeps her diary ___ the drawer beside her bed.",
      "context": "daily routines",
      "options": [
        { "id": "A", "text": "into" },
        { "id": "B", "text": "on" },
        { "id": "C", "text": "in" },
        { "id": "D", "text": "under" }
      ]
    },
    "answer": {
      "value": "in",
      "correctOptionIds": ["C"],
      "acceptedAnswers": ["in"]
    },
    "explanation": "'Keeps' here describes a usual location, so 'in' is the neutral preposition for position.",
    "testedAspects": [
      "in for position",
      "simple present in daily routine",
      "third-person singular verb form"
    ],
    "distractors": [
      {
        "optionId": "A",
        "reason": "Learner chooses movement preposition even though there is no movement in this statement.",
        "errorType": "movement_without_motion"
      },
      {
        "optionId": "B",
        "reason": "Learner chooses a surface-contact preposition instead of container position.",
        "errorType": "wrong_relation"
      },
      {
        "optionId": "D",
        "reason": "Learner chooses an unrelated relation preposition.",
        "errorType": "wrong_relation"
      }
    ],
    "tags": [
      "grammar",
      "prepositions",
      "in_inside_into",
      "A2",
      "daily routines"
    ],
    "metadata": {
      "source": "eng_grammar_place_in_inside_into_a2",
      "generatedBy": "GPT-5.3-Codex",
      "generatedAt": "2026-08-11T00:00:00Z",
      "version": "1.0"
    }
  }
]
